{"$id":"https://ambient-os.local/contracts/policy_decision.schema.json","$schema":"https://json-schema.org/draft/2020-12/schema","description":"Signed ALLOW token emitted by context-fabric (Layer 2). A DENY result is returned by the evaluator/generator API as an object with decision=DENY, empty capabilities and NO signature field; a DENY is never a valid token under this schema's verification rules (see verify in INTERFACE.md).","properties":{"action":{"type":"string"},"ambient_state":{"enum":["HOME","SLEEP","AWAY",null],"type":["string","null"]},"allowed_capabilities":{"description":"Allowed capability tags / peripherals granted.","items":{"type":"string"},"type":"array"},"decision":{"const":"ALLOW"},"decision_id":{"format":"uuid","type":"string"},"expires_at":{"description":"UTC, format YYYY-MM-DDTHH:MM:SSZ","type":"string"},"issued_at":{"description":"UTC, format YYYY-MM-DDTHH:MM:SSZ","type":"string"},"matched_permit_ids":{"items":{"type":"string"},"type":"array"},"resource":{"type":"string"},"signature":{"description":"HMAC-SHA256 hex digest over the canonical token body (token without this field, JSON sorted keys, separators ',' and ':'). Dev scheme only — see INTERFACE.md.","pattern":"^[0-9a-f]{64}$","type":"string"},"ttl_seconds":{"type":"integer"},"user_role":{"enum":["OWNER","GUEST","UNKNOWN"],"type":"string"}},"required":["decision","allowed_capabilities","user_role","action","resource","issued_at","expires_at","decision_id","signature"],"title":"policy_decision","type":"object"}